ID	OMEGAWIKI	GLOSS	SEMANTICFIELD	DEFINITION	ONTOLOGICAL_CATEGORY
436	1541200	WHITE-LIPPED PECCARY	Animals	piglike hoofed mammal, of North and South America, having a black gray coat with whitish cheeks; larger than the collared peccary.	Person/Thing
437	1541204	GUAN	Animals	a large game bird of the curassow family, common in dense woodlands of Central and South America.	Person/Thing
438	1541208	CHIGGOE (JIGGER FLEA)	Animals	a flea, Tunga penetrans,  of tropical America and Africa, the impregnated female of which embeds itself in the skin, especially of the feet, of humans and animals and becomes greatly distended with eggs.	Person/Thing
439	1541218	CEBUS MONKEY	Animals	a Central and South American monkey, Cebus capucinus,  having a prehensile tail and hair on the head resembling a cowl.	Person/Thing
440	1541228	CHONTA PALM	Agriculture and vegetation	species of flowering plant in the Arecaceae family, trunked palm tree which is endemic to the Juan Fernández Islands archipielago in the southeast Pacific Ocean west of Chile.	Person/Thing
441	1541232	CHICHA	Food and drink	a beverage made from fermented corn in South and Central America.	Person/Thing
442	1541236	FRONT TOOTH (INEISOR_	The body	several teeth located above and below in the mouth of mammals to bite food off.	Person/Thing
443	1541242	TIP (OF TONGUE)	The body	front part of the tongue.	Person/Thing
444	1541248	LONG HAIR	The body	Hair that is not cut.	Person/Thing
445	1541252	UPPER BACK	The body	upper part of the back.	Person/Thing
446	1541256	LOWER ARM	The body	the part of the arm between the elbow and the hand.	Person/Thing
447	1541261	LOWER LEG	The body	part of the leg between the knee and the foot.	Person/Thing
448	1541265	STORM CLOUDS	The physical world	darkish clouds attending a windstorm.	Person/Thing
449	1541269	CORN FIELD	Agriculture and vegetation	a field in which corn is grown.	Person/Thing
450	1542267	CUSHMA	Clothing and grooming	a one-piece dress used by the Ashaninka Indians.	Person/Thing
451	1542657	HARMATTAN	Time	Dry, dusty and cold West African trade wind from northeastern direction.	Person/Thing
452	1542663	DRY SEASON	Time	Yearly period of low rainfall in the tropics.	Person/Thing
453	1542669	RAINY SEASON	Time	Period of year when most of a region's average annual rainfall occurs.	Person/Thing
454	1542675	SHEA NUT TREE	Agriculture and vegetation	Tree of the Sapotaceae family,indigenous to Africa, commonly known as shea tree. The shea fruits are oil-rich seed from which shea butter is extracted.	Person/Thing
455	1542685	MAHOGANY TREE	Agriculture and vegetation	A species of trees in the mahogany family Meliaceae, native to tropical Africa and Madagascar.	Person/Thing
456	1542693	GUINEA FOWL	Animals	Bird of the family Phasianidae native to Africa.	Person/Thing
457	1542706	BLIND PERSON	Kinship	Person who has a complete lack of form and visual light perception.	Person/Thing
458	1542714	DEAF PERSON	Kinship	Person who is  partial or total unable to hear.	Person/Thing
459	1542724	SNAPP (OF STICK)	Basic actions and technology	Quick breaking or cracking sound or the action of producing such a sound.	Action/Process
460	1542733	BREAK (OF ROPE)	Basic actions and technology	the breaking of a thread or strap.	Action/Process
461	1543020	BOUBOU	Clothing and grooming	a flowing wide sleeved robe worn by men in much of West Africa, and to a lesser extent in North Africa.	Person/Thing
462	1543026	WRAPPER	Clothing and grooming	a colorful women's garment widely worn in West Africa.	Person/Thing
463	1543589	FELL A TREE	Agriculture and vegetation	To knock somebody or cut something down, e.g. a tree.	Action/Process
464	1543597	ALANG-ALANG GRASS	Agriculture and vegetation	It is a perennial high grown grass native to Asia, Australia and Africa.	Person/Thing
465	1543608	CARRY ON BACK	Motion	To hold or to take something from one place to another on the back.	Action/Process
466	1543612	CASSOWARY	Animals	A big flightless bird native to tropical forests of New Guinea, nearby islands and northeastern Australia.	Person/Thing
467	1543617	CRAYFISH	Animals	A freshwater crustacean resembling small lobster.	Person/Thing
468	1543622	G-STRING	Clothing and grooming	A thong underwear or swimsuit, a narrow piece of cloth, leather, or plastic, that covers or holds the genitals, passes between the buttocks, and is attached to a band around the hips.	Person/Thing
469	1543627	PANDANUS	Agriculture and vegetation	Palm-like, dioecious trees and shrubs native to the Old World tropics and subtropics.	Person/Thing
470	1543631	POSSUM	Animals	Small to medium-sized arboreal marsupial species native to Australia, New Guinea, and Sulawesi.	Person/Thing
471	1543636	UPPER LEG	The body	The part of the leg between the pelvis and the knee.	Person/Thing
472	1544449	PELICAN	Animals	Large water birds comprising the family Pelecanidae. They are characterised by a long beak and large throat pouch used for catching prey and draining water from the scooped up contents before swallowing.	Person/Thing
473	1544459	SPEAR ACTION	Warfare and hunting	To penetrate or strike with, or as if with, any long narrow object. To make a thrusting motion that catches an object on the tip of a long device.	Action/Process
474	154560	DRESS	Clothing and grooming	A one-piece garment for a woman that has a skirt and a body section.	Person/Thing
475	154568	UNTRUTH	Emotions and values	A false statement made with the intention to deceive.	Person/Thing
476	154685	CUP	Food and drink	A concave vessel for holding liquid, generally adorned with either a handle or a stem	Person/Thing
477	154705	LATE	Time	After the expected or usual time.	Other
478	154710	LIP	The body	Either of the two fleshy protrusions around the opening of the mouth.	Person/Thing
479	154737	GROW	Spatial relations	(For a living being) To become bigger.	Action/Process
480	154781	PLATE	Food and drink	A dish on which food is served or from which food is eaten.	Person/Thing
481	154785	DISH	Food and drink	A vessel such as a plate for holding or serving food, often flat with a depressed region in the middle.	Person/Thing
482	154801	NOBLE	Social and political relations	Someone of aristocratic blood.	Person/Thing
483	155053	COMPOUND	Social and political relations	An enclosure of residences and other buildings.	Person/Thing
484	155122	CONDEMN	Law	To declare, after a judgement, that somebody is guilty of commiting a crime.	Action/Process
485	155161	DISAPPEAR	Motion	To cease to appear, to not be visible anymore.	Action/Process
486	155405	MINISTER	Modern world	A person appointed to a high office in the government.	Person/Thing
487	155571	SHY	Emotions and values	(For a personality) characterized by being uncomfortable with having attention drawn to them, for example when introducing oneself or when speaking in front of an audience.	Property
488	155620	MANNER	Cognition	Way of performing or effecting anything.	Person/Thing
489	155634	KIDNEY	The body	An organ in the body that produces urine.	Person/Thing
490	155705	DESCENDANTS	Kinship	One who is the progeny of someone at any distance of time.	Person/Thing
491	155907	CENTER	Spatial relations	The middle part, that can be clearly discerned from the enveloping part.	Person/Thing
492	156096	THREE	Quantity	The third natural number (3).	Other
493	156104	FIVE	Quantity	The fifth natural number (5).	Other
494	1562957	FLIRT	Emotions and values	To talk or behave amorously, without serious intentions.	Action/Process
495	1563403	REVENGE	Emotions and values	To take revenge for a perceived wrong.	Action/Process
496	156381	CUCUMBER	Agriculture and vegetation	The edible fruit of the cucumber plant, having a green rind and crisp white flesh.	Person/Thing
497	156420	SCAR	The body	A permanent mark on the skin resulting from a wound.	Person/Thing
498	156660	CALF OF LEG	The body	The fleshy backside of the lower part of the leg.	Person/Thing
499	156675	CURE	The body	To remedy an illness using medical or medicamentous treatment; to provide a cure for.	Action/Process
500	156727	CRUEL	Emotions and values	Indifference towards the suffering of another and even deriving a positive feeling from it.	Property
501	156785	LIFT	Motion	To cause an object to have a higher location than previously.	Action/Process
502	156863	NAIL (TOOL)	Basic actions and technology	A spike-shaped metal fastener used for joining wood or similar materials.	Person/Thing
503	1570	FROG	Animals	Any insectivorous anuran amphibian of the family Ranidae, such as Rana temporaria of Europe, having a short squat tailless body with a moist smooth skin and very long hind legs specialized for hopping.	Person/Thing
504	157124	LEARN	Cognition	To acquire, or attempt to acquire knowledge or an ability to do something.	Action/Process
505	157257	PARENTS	Kinship	Father and mother of a child.	Person/Thing
506	157264	MAIZE	Agriculture and vegetation	A type of grain of the species Zea mays.	Person/Thing
507	157304	MELON	Agriculture and vegetation	A fruit of any of the species from the family Cucurbitaceae that has relatively hard inedible shells and plenty of sweet flesh. The fruits may vary in size but is usually not smaller than one decimeter in diameter.	Person/Thing
508	1573566	PERIOD	Time	A length of time.	Person/Thing
509	157395	CERTAIN	Cognition	Without any doubt or possibility of deviation.	Property
510	1575935	STRONG EFFECT	Sense perception	Having a strong physiological or chemical effect.	Property
511	1577338	BAOZI	Food and drink	A baozi or simply known as bao, bau, humbow, nunu, bausak, pow or pau is a type of steamed, filled bun or bread-like (i.e. made with yeast) item in various Chinese cuisines.	Person/Thing
512	1577362	SEE A DOCTOR	Motion	to see a doctor	Action/Process
513	1577366	THIS YEAR	Time	this year	Other
514	1577370	LAST YEAR	Time	last year	Other
515	1577374	NEXT YEAR	Time	next year	Other
516	1577378	PERSON (CLASSIFIER)	Quantity	classifier for persons	Classifier
517	1577388	FIREDRILL	Motion	A fire drill is a method of practicing the evacuation of a building for a fire or other emergency.	Person/Thing
518	1578717	SPARK	The physical world	A small particle or body of shining or glowing matter, either molten or on fire.	Person/Thing
519	1578721	SPOT	The physical world	A round or irregular patch on the surface of a thing having a different color, texture etc. and generally round in shape.	Person/Thing
520	1579894	MANZANITA	Agriculture and vegetation	Species of the genus Arctostaphylos; evergreen shrubs or small trees present in the chaparral biome of western North America.	Person/Thing
521	1579898	TULE	Agriculture and vegetation	A giant species of sedge in the plant family Cyperaceae, native to freshwater marshes. Dyed and woven, tules are used to make baskets, bowls, mats, hats, clothing, duck decoys, and even boats by Native American groups.	Person/Thing
522	158033	WOLF	Animals	A large wild canid (Canidae), closely related to the dog.	Person/Thing
523	1580787	BACK OF HEAD	The body	The back part of the head.	Person/Thing
524	1580799	BARBEL	Animals	European freshwater fish belonging to the family of carps (Cyprinidae), Genus of barbus.	Person/Thing
525	1580827	BLOOD VESSEL	The body	The blood vessels are the part of the circulatory system that transports blood throughout the human body.	Person/Thing
526	158088	HOWL	Speech and language	The protracted, mournful cry of a dog or a wolf.	Action/Process
527	1580939	DOG-ROSE	Agriculture and vegetation	The dog-rose (rosa canina) is a variable climbing wild rose species native to Europe, northwest Africa and western Asia and whose fruit is known as hip.	Person/Thing
528	1580946	DREADFUL	Emotions and values	Causing dread; very bad.	Property
529	1580954	FLANK	Warfare and hunting	The extreme left or right edge of a military formation, army etc.	Person/Thing
530	1580959	FRECKLE	The body	A small brownish or reddish pigmentation spot on the surface of the skin.	Person/Thing
531	158133	HOW MUCH	Cognition	In what amount.	Other
532	1581331	GIPSY	Social and political relations	Gipsy is a common word used to indicate Romani people, Tinkers and Travellers.	Person/Thing
533	1581337	GLUTTON	Food and drink	Person who habitually eats and drinks excessively.	Person/Thing
534	1581343	HUMP	The body	A hump may refer to a camel's hump containing its fat reservoir or alternatively to the curve on an upper spine that causes a hunchback.	Person/Thing
535	1581347	INFLATED	The physical world	Exaggerated or made bigger.	Property
536	1581352	LOW VOICE	Speech and language	Speaking quietly: to talk in a low voice.	Other
537	1581541	TURBID	The physical world	A fluid which is cloudy or hazy due to large numbers of individual particles that are generally invisible to the naked eye, similar to smoke in air.	Person/Thing
538	1581546	MULTITUDE	Quantity	A large number of something.	Person/Thing
539	1581551	NEST	Animals	A nest is a structure built by vertebrates to hold its eggs, its offspring, or occasionally the animal itself and may be composed of organic material such as twigs, grass, and leaves, or may be a simple depression in the ground, or a hole in a rock, tree, or building.	Person/Thing
540	1581560	PALATE	The body	The palate is the roof of the mouth in humans and other mammals.	Person/Thing
541	1581589	POETRY	Speech and language	The class of literature comprising poems; a poet's literary production; composition in verse or language exhibiting conscious attention to patterns.	Person/Thing
542	1581601	SCANTY	Quantity	Somewhat less than is needed in amplitude or extent.	Property
543	1581605	SHUTTLE	Clothing and grooming	Device used in weaving to carry the weft, moving continuously to-and-fro.	Person/Thing
544	1581678	SPICY	Food and drink	Of, pertaining to, or containing spice; or spicy flavour: Provoking a burning sensation due to the presence of chillies or similar hot spices.	Property
545	1581689	SPRUCE	Agriculture and vegetation	Any of various large coniferous evergreen trees from the genus Picea, found in northern temperate and boreal regions.	Person/Thing
546	1581694	SUCKER	Agriculture and vegetation	An undesired stem growing out of the roots or lower trunk of a shrub or tree, especially from the rootstock of a grafted plant or tree.	Person/Thing
547	1581700	SURFACE	The physical world	The overside or up-side of a flat object such as a table, or of a liquid; the outside hull of a tangible object.	Person/Thing
548	1581708	INFECTED	The body	Referring to something that has received an infection	Property
549	1581715	COPULATE	The body	To engage in sexual intercourse.	Action/Process
550	1581721	DILUTE	The physical world	To weaken or make thinner by adding a foreign substance or a solvent (e.g. water) to a solution.	Action/Process
551	1581727	DISLOCATE	The body	to (accidentally) dislodge a skeletal bone from its joint	Action/Process
552	1581756	GROW UP	Cognition	To mature and become an adult.	Action/Process
553	1581762	HEW	The physical world	To chop away at; to whittle down; to mow down.	Action/Process
554	1581766	HINDER	The physical world	To make difficult to accomplish; to frustrate, act as obstacle; to keep back; to delay or impede; to prevent.	Action/Process
555	1581772	INFRINGE	Law	To commit a crime less serious than a felony.	Action/Process
556	1581779	MARRY OFF	Kinship	To force someone to get married, usually a relative.	Action/Process
557	1581784	OFFEND	Social and political relations	To hurt the feelings of; to displease; to make angry; to insult.	Action/Process
558	1581790	PASS BY	Motion	To travel past without stopping.	Action/Process
559	1581800	BROTHER (OF MAN)	Kinship	The brother of a man.	Person/Thing
560	1581804	BROTHER (OF WOMAN)	Kinship	The brother of a woman.	Person/Thing
561	1581808	SISTER (OF MAN)	Kinship	The sister of a man.	Person/Thing
562	1581812	SISTER (OF WOMAN)	Kinship	The sister of a woman.	Person/Thing
563	1581816	YOUNG (OF WOMAN)	Time	Young of a woman as opposed to young of a man.	Property
564	1581820	YOUNG (OF MAN)	Time	Young of a man as opposed to young of a woman.	Property
565	1581826	OLD (OF MAN)	Time	Old of a man as opposed to old of a woman.	Property
566	1581829	OLD (OF WOMAN)	Time	Old of a woman as opposed to old of a man.	Property
567	1581981	REBEL	Social and political relations	To resist or become defiant toward an authority.	Action/Process
568	1581986	RISE (MOVE UPWARDS)	The physical world	(Of a heavenly body) To appear to move upwards from behind the horizon of a planet as a result of the planet's rotation.	Action/Process
569	1581989	SPOIL (BECOME SPOILED)	Food and drink	Of food, to become bad, sour or rancid; to decay.	Action/Process
570	1581992	STAND UP	Motion	To rise from a lying or sitting position.	Action/Process
571	1581997	STING	The body	To hurt, usually by introducing poison or a sharp point, or both.	Action/Process
572	1582001	STREW	Motion	To distribute objects or pieces of something over an area, especially in a random manner.	Action/Process
573	1582012	SWAY	Motion	To move or swing from side to side; or backward and forward; to rock.	Action/Process
574	1582031	TRANSIT	Motion	To pass over, across or through something.	Action/Process
575	1582035	TREAD	Motion	To step or walk (on or over something); to trample.	Action/Process
576	158253	DANDRUFF	The body	Small portion of dead skin cells shedding from the scalp.	Person/Thing
577	158386	FOREFINGER	The body	The finger between thumb and long finger.	Person/Thing
578	158442	KISS	Emotions and values	To touch with the lips to express love or affection.	Action/Process
579	158617	BATTLE	Warfare and hunting	An instance of combat in warfare between two or more parties wherein each group will seek to defeat the others.	Person/Thing
580	1590	FUR	Clothing and grooming	The hair-covered, dressed pelt of a mammal, used in the making of garments and as trimming or decoration.	Person/Thing
581	159011	COME BACK	Motion	To go there where one was before.	Action/Process
582	159035	LEND	Possession	To put an item or resource at the disposal of another, with the requirement to have the same or its equivalent returned eventually.	Action/Process
583	159058	KIND OR POLITE	Emotions and values	Possessing charm and attractiveness.	Property
584	159359	DIFFICULT	Cognition	Not easy, which needs hard work, patience and effort.	Property
585	159566	BOOT	Clothing and grooming	A shoe that covers part of the leg.	Person/Thing
586	1601	GARDEN	Agriculture and vegetation	A piece of land next to a house where flowers and other plants are grown and which often has an area of grass.	Person/Thing
587	160271	ANT	Animals	Any of the black, red, brown, or yellow insects of the family Formicidae characterized by a large head and by living in organized colonies.	Person/Thing
588	160300	BROKEN	Basic actions and technology	Not capable of working.	Property
589	160351	CLOSED	Spatial relations	Inaccessible	Property
590	160368	NAKED	The body	Without clothing.	Property
591	160397	ADDRESS	Modern world	Direction or superscription of a letter, or the name, title, and place of residence of the person addressed.	Person/Thing
592	160433	PISS	The body	To allow urine to flow from the bladder out of the body.	Action/Process
593	160661	POTATO	Food and drink	A tuberous plant, Solanum tuberosum, often eaten as a starchy vegetable, particularly in the Americas and Europe.	Person/Thing
594	160850	PIECE	Quantity	One object of a set, undivided part of something broken.	Person/Thing
595	161168	GROUNDNUTS	Agriculture and vegetation	A nutlike fruit from the plant Arachis hypogaea that grows on long stems under ground.	Person/Thing
596	161415	POSTAGE STAMP	Modern world	A piece of paper that is affixed to letters or packages to pay for their delivery.	Person/Thing
597	161474	PHYSICIAN	The body	A person who has completed a study of medicine, and as such tries to diagnose and cure diseases in patients.	Person/Thing
598	161542	SHELL	Animals	a hard outer covering of an animal, as the hard case of a mollusk	Person/Thing
599	161564	DRIVER'S LICENSE	Modern world	Official document granting someone the authorisation to drive some vehicles.	Person/Thing
600	161713	STRANGE	Cognition	Out of the ordinary.	Property
601	161769	LIE (MISLEAD)	Emotions and values	To knowingly say something that is untrue.	Action/Process
602	161806	HIDE, CONCEAL	Spatial relations	To put something in a place where it will be harder to discover or out of sight.	Action/Process
603	161851	COAT	Clothing and grooming	An outer garment covering the upper torso and arms.	Person/Thing
604	1656	GLASS	Basic actions and technology	A hard, amorphous, inorganic, usually transparent, brittle substance made by fusing silicates, sometimes borates and phosphates, with certain basic oxides and then rapidly cooling to prevent crystallization.	Person/Thing
605	1674	GRAIN	Agriculture and vegetation	Edible, starchy seeds of the grass family (Graminae) usable as food by man and his livestock.	Person/Thing
606	1675	GRASS	Agriculture and vegetation	A very large and widespread family of Monocotyledoneae, with more than 10.000 species, most of which are herbaceous, but a few are woody. The stems are jointed, the long, narrow leaves originating at the nodes. The flowers are inconspicuous, with a much reduced perianth, and are wind-pollinated or cleistogamous.	Person/Thing
607	1677	GRASSHOPPER	Animals	A plant-eating insect with long back legs that can jump very high and makes a sharp high noise using its back legs or wings.	Person/Thing
608	1702	GULF	The physical world	An inlet of the sea of large areal proportions, more indented than a bay and generally more enclosed.	Person/Thing
609	1707	HAIL	The physical world	Precipitation in the form of balls or irregular lumps of ice.	Person/Thing
610	1717	PORT	Motion	Area of water next to the coast, often surrounded by thick walls, where ships and boats can be sheltered.	Person/Thing
611	1722	HARVEST	Agriculture and vegetation	The amount or measure of the crop gathered in a season.	Person/Thing
612	1746	HEAT	The physical world	A form of energy that is transferred by a difference in temperature: it is equal to the total kinetic energy of the atoms or molecules of a system.	Person/Thing
613	1769	HIGH TIDE	The physical world	The level of water when the tide is at its highest level.	Person/Thing
614	1772	HILL	The physical world	A natural elevation of the land surface, usually rounded.	Person/Thing
615	1780	HORSE	Animals	A large animal with four legs of the Equus caballus species which people ride on or use for carrying things or pulling vehicles.	Person/Thing
616	1782	HOSPITAL	Modern world	A place where people who are ill or injured are treated and taken care of by doctors and nurses.	Person/Thing
617	1837	ICE	The physical world	The dense substance formed by the freezing of water to the solid state; it commonly occurs in the form of hexagonal crystals.	Person/Thing
618	1875	PRECIPICE	The physical world	The inclined surface of any part of the Earth's surface, as a hillslope; also, a broad part of a continent descending toward an ocean, as the Pacific slope. (Source: BJGEO)	Person/Thing
619	194	ANIMAL	Animals	Any living organism characterized by voluntary movement, the possession of cells with noncellulose cell walls and specialized sense organs enabling rapid response to stimuli, and the ingestion of complex organic substances such as plants and other animals.	Person/Thing
620	1959	INSECT	Animals	A class of the Arthropoda typically having a segmented body with an external chitinous covering, a pair of compound eyes, a pair of antennae, three pairs of mouthparts, and two pairs of wings.	Person/Thing
621	2024	IRON	Basic actions and technology	A malleable ductile silvery-white ferromagnetic metallic element with symbol Fe and atomic number 26, occurring principally in haematite and magnetite. It is widely used for structural and engineering purposes.	Person/Thing
622	2031	ISLAND	The physical world	A land mass, especially one smaller than a continent, entirely surrounded by water.	Person/Thing
623	2058	LAGOON	The physical world	A body of water cut off from the open sea by coral reefs or sand bars.	Person/Thing
624	2061	LAKE	The physical world	An enclosed body of water, usually but not necessarily fresh water, from which the sea is excluded.	Person/Thing
625	2062	LAMP	The house	A device that produces light, such as an electric lamp.	Person/Thing
626	2063	LAND	The physical world	A specified geographical tract of the Earth's surface including all its attributes, comprising its geology, superficial deposits, topography, hydrology, soils, flora and fauna, together with the results of past and present human activity, to the extent that these attributes exert a significant influence on the present and future land utilization. (Source: WHIT)	Person/Thing
627	2119	LEAD, CHEMICAL ELEMENT	Basic actions and technology	A heavy toxic bluish-white metallic element with symbol Pb and atomic number 82 that is highly malleable; occurs principally as galena and is used in alloys, accumulators, cable sheaths, paints, and as a radiation shield.	Person/Thing
628	2124	LEAF	Agriculture and vegetation	The main organ of photosynthesis and transpiration in higher plants, usually consisting of a flat green blade attached to the stem directly or by a stalk.	Person/Thing
629	2126	LEATHER	Clothing and grooming	The dressed or tanned hide of an animal, usually with the hair removed.	Person/Thing
630	2158	LIGHT RADIATION	The physical world	Electromagnetic radiation that is capable of causing a visual sensation. (Source: CED)	Person/Thing
631	2183	LIVESTOCK	Animals	Cattle, horses, and similar animals kept for domestic use especially on a farm.	Person/Thing
632	2189	LIZARD	Animals	Any reptile of the suborder Lacertilia, especially those of the family Lacertidae, typically having an elongated body, four limbs, and a small tail: includes the gechos, iguanas, chameleons, monitors, and slow worms.	Person/Thing
633	2276	MARKET	Possession	Place of commercial activity in which articles are bought and sold.	Person/Thing
634	2300	MEAT	Food and drink	The edible flesh of animals, especially that of mammals.	Person/Thing
